<?xml version="1.0" encoding="UTF-8"?>
<Astrolabe xmlns="http://www.cartacelestis.eu/astrolabe/model"
	xmlns:xsi="http://www.w3.org/2001/XMLSchema-instance"
	xsi:schemaLocation="http://www.cartacelestis.eu/astrolabe/model
astrolabe.xsd">
	<Date>
		<DateOccidental>
			<YMD y="2000" m="1" d="1" />
		</DateOccidental>
	</Date>
	<Chart>
		<ChartStereographic pagesize="a4" hemisphere="northern">
			<!--eqp-24.5-->
			<Horizon>
				<HorizonEquatorial practicality="none">
					<Latitude>
						<Rational value="0.0" />
					</Latitude>
					<Circle>
						<CircleParallel name="eqp-24.5"
							importance="canonical">
							<Angle>
								<Rational value="-24.5" />
							</Angle>
							<Begin>
								<Immediate>
									<Rational value="0" />
								</Immediate>
							</Begin>
							<End>
								<Immediate>
									<Rational value="360" />
								</Immediate>
							</End>
						</CircleParallel>
					</Circle>
				</HorizonEquatorial>
			</Horizon>
			<!--galactic-->
			<Horizon>
				<HorizonGalactic practicality="seldom">
					<Latitude>
						<DMS min="0" sec="0.0" deg="0" />
					</Latitude>
					<Circle>
						<CircleParallel importance="canonical">
							<Angle>
								<Rational value="-80" />
							</Angle>
							<Begin>
								<Reference circle="eqp-24.5"
									node="chasing" />
							</Begin>
							<End>
								<Reference circle="eqp-24.5"
									node="leading" />
							</End>
						</CircleParallel>
					</Circle>
					<Circle>
						<CircleParallel importance="canonical">
							<Angle>
								<Rational value="-60" />
							</Angle>
							<Begin>
								<Reference circle="eqp-24.5"
									node="chasing" />
							</Begin>
							<End>
								<Reference circle="eqp-24.5"
									node="leading" />
							</End>
						</CircleParallel>
					</Circle>
					<Circle>
						<CircleParallel importance="canonical">
							<Angle>
								<Rational value="-40" />
							</Angle>
							<Begin>
								<Reference circle="eqp-24.5"
									node="chasing" />
							</Begin>
							<End>
								<Reference circle="eqp-24.5"
									node="leading" />
							</End>
						</CircleParallel>
					</Circle>
					<Circle>
						<CircleParallel importance="canonical">
							<Angle>
								<Rational value="-20" />
							</Angle>
							<Begin>
								<Reference circle="eqp-24.5"
									node="chasing" />
							</Begin>
							<End>
								<Reference circle="eqp-24.5"
									node="leading" />
							</End>
						</CircleParallel>
					</Circle>
					<!--horizon-->
					<Circle>
						<CircleParallel importance="cardinal">
							<Angle>
								<Rational value="0.0" />
							</Angle>
							<Begin>
								<Reference circle="eqp-24.5"
									node="chasing" />
							</Begin>
							<End>
								<Reference circle="eqp-24.5"
									node="leading" />
							</End>
							<Dial>
								<DialAngle baseline="none"
									reflect="false">
									<GraduationSpan span="10"
										division="1">
										<AnnotationStraight
											purpose="dialsubnumber" anchor="middleleft" radiant="false"
											reverse="false">
											<Text
												value="@{dialdeg}@&#x00b0;" />
										</AnnotationStraight>
									</GraduationSpan>
									<Annotation>
										<AnnotationCurved
											purpose="dialdescription" anchor="bottomleft" radiant="false"
											reverse="false" distance="18.5">
											<Text
												value="Galaktische L&#x00e4;nge (&#x0394;l 10&#x00b0;)" />
										</AnnotationCurved>
									</Annotation>
								</DialAngle>
							</Dial>
						</CircleParallel>
					</Circle>
					<Circle>
						<CircleParallel importance="canonical">
							<Angle>
								<Rational value="20" />
							</Angle>
							<Begin>
								<Reference circle="eqp-24.5"
									node="leading" />
							</Begin>
							<End>
								<Reference circle="eqp-24.5"
									node="chasing" />
							</End>
						</CircleParallel>
					</Circle>
					<Circle>
						<CircleParallel importance="canonical">
							<Angle>
								<Rational value="40" />
							</Angle>
							<Begin>
								<Immediate>
									<Rational value="0.0" />
								</Immediate>
							</Begin>
							<End>
								<Immediate>
									<Rational value="360" />
								</Immediate>
							</End>
						</CircleParallel>
					</Circle>
					<Circle>
						<CircleParallel importance="canonical">
							<Angle>
								<Rational value="60" />
							</Angle>
							<Begin>
								<Immediate>
									<Rational value="0.0" />
								</Immediate>
							</Begin>
							<End>
								<Immediate>
									<Rational value="360" />
								</Immediate>
							</End>
						</CircleParallel>
					</Circle>
					<Circle>
						<CircleParallel importance="canonical">
							<Angle>
								<Rational value="80" />
							</Angle>
							<Begin>
								<Immediate>
									<Rational value="0.0" />
								</Immediate>
							</Begin>
							<End>
								<Immediate>
									<Rational value="360" />
								</Immediate>
							</End>
						</CircleParallel>
					</Circle>
					<!--meridians-->
					<Circle>
						<CircleMeridian importance="canonical">
							<Angle>
								<Rational value="0.0" />
							</Angle>
							<Begin>
								<Reference circle="eqp-24.5"
									node="leading" />
							</Begin>
							<End>
								<Immediate>
									<DMS deg="85" min="0" sec="0.0" />
								</Immediate>
							</End>
						</CircleMeridian>
					</Circle>
					<Circle>
						<CircleMeridian importance="canonical">
							<Angle>
								<Rational value="30" />
							</Angle>
							<Begin>
								<Reference circle="eqp-24.5"
									node="leading" />
							</Begin>
							<End>
								<Immediate>
									<DMS deg="85" min="0" sec="0.0" />
								</Immediate>
							</End>
						</CircleMeridian>
					</Circle>
					<Circle>
						<CircleMeridian importance="canonical">
							<Angle>
								<Rational value="60" />
							</Angle>
							<Begin>
								<Reference circle="eqp-24.5"
									node="leading" />
							</Begin>
							<End>
								<Immediate>
									<DMS deg="85" min="0" sec="0.0" />
								</Immediate>
							</End>
						</CircleMeridian>
					</Circle>
					<Circle>
						<CircleMeridian importance="canonical">
							<Angle>
								<Rational value="90" />
							</Angle>
							<Begin>
								<Immediate>
									<DMS deg="-85" min="0" sec="0.0" />
								</Immediate>
							</Begin>
							<End>
								<Immediate>
									<DMS deg="85" min="0" sec="0.0" />
								</Immediate>
							</End>
						</CircleMeridian>
					</Circle>
					<Circle>
						<CircleMeridian importance="canonical">
							<Angle>
								<Rational value="120" />
							</Angle>
							<Begin>
								<Immediate>
									<DMS deg="-85" min="0" sec="0.0" />
								</Immediate>
							</Begin>
							<End>
								<Immediate>
									<DMS deg="85" min="0" sec="0.0" />
								</Immediate>
							</End>
						</CircleMeridian>
					</Circle>
					<Circle>
						<CircleMeridian importance="canonical">
							<Angle>
								<Rational value="150" />
							</Angle>
							<Begin>
								<Immediate>
									<DMS deg="-85" min="0" sec="0.0" />
								</Immediate>
							</Begin>
							<End>
								<Immediate>
									<DMS deg="85" min="0" sec="0.0" />
								</Immediate>
							</End>
						</CircleMeridian>
					</Circle>
					<Circle>
						<CircleMeridian importance="canonical">
							<Angle>
								<Rational value="180" />
							</Angle>
							<Begin>
								<Reference circle="eqp-24.5"
									node="chasing" />
							</Begin>
							<End>
								<Immediate>
									<DMS deg="85" min="0" sec="0.0" />
								</Immediate>
							</End>
							<Dial>
								<DialAngle baseline="none"
									reflect="false">
									<GraduationSpan span="20"
										division="1">
										<AnnotationStraight
											purpose="guidance" anchor="topleft" radiant="false"
											reverse="false">
											<Text
												value="@{dialdeg}@&#x00b0;" />
										</AnnotationStraight>
									</GraduationSpan>
									<Annotation>
										<AnnotationCurved
											purpose="guidance" anchor="middleleft" radiant="false"
											reverse="false" distance="12">
											<Text
												value="Galaktische Breite (&#x0394;b 20&#x00b0;)" />
										</AnnotationCurved>
									</Annotation>
								</DialAngle>
							</Dial>
						</CircleMeridian>
					</Circle>
					<Circle>
						<CircleMeridian importance="canonical">
							<Angle>
								<Rational value="210" />
							</Angle>
							<Begin>
								<Reference circle="eqp-24.5"
									node="leading" />
							</Begin>
							<End>
								<Immediate>
									<DMS deg="85" min="0" sec="0.0" />
								</Immediate>
							</End>
						</CircleMeridian>
					</Circle>
					<Circle>
						<CircleMeridian importance="canonical">
							<Angle>
								<Rational value="240" />
							</Angle>
							<Begin>
								<Reference circle="eqp-24.5"
									node="leading" />
							</Begin>
							<End>
								<Immediate>
									<DMS deg="85" min="0" sec="0.0" />
								</Immediate>
							</End>
						</CircleMeridian>
					</Circle>
					<Circle>
						<CircleMeridian importance="canonical">
							<Angle>
								<Rational value="270" />
							</Angle>
							<Begin>
								<Reference circle="eqp-24.5"
									node="leading" />
							</Begin>
							<End>
								<Immediate>
									<DMS deg="85" min="0" sec="0.0" />
								</Immediate>
							</End>
						</CircleMeridian>
					</Circle>
					<Circle>
						<CircleMeridian importance="canonical">
							<Angle>
								<Rational value="300" />
							</Angle>
							<Begin>
								<Reference circle="eqp-24.5"
									node="leading" />
							</Begin>
							<End>
								<Immediate>
									<DMS deg="85" min="0" sec="0.0" />
								</Immediate>
							</End>
						</CircleMeridian>
					</Circle>
					<Circle>
						<CircleMeridian importance="canonical">
							<Angle>